{
  "version": "2.0",
  "document": {
    "title": "高风险放射源监管平台投标技术方案",
    "projectName": "甘肃省高风险放射源监管平台",
    "bidSection": "总体技术方案与数据资源建设"
  },
  "style": {
    "theme": "formal_blue",
    "tone": "formal_bid",
    "preferredFormat": "both"
  },
  "illustrations": [
    {
      "id": "overall_architecture",
      "type": "architecture.layered",
      "renderer": "auto",
      "intent": "解释平台分层、用户入口、核心服务、数据与安全保障之间的关系",
      "insertion": {
        "section": "3.1 系统总体架构设计",
        "caption": "图3-1 系统总体架构图",
        "purpose": "说明平台总体能力组成"
      },
      "data": {
        "title": "高风险放射源监管平台系统总体架构图",
        "subtitle": "统一接入·业务协同·数据赋能·安全保障 — 四层架构体系",
        "note": "本架构满足 GB/T 22239-2019 等保三级要求，数据加密传输、操作全量审计",
        "actors": [
          {
            "title": "省级监管部门",
            "desc": "监测研判 · 决策指挥",
            "icon": "users",
            "style": "accent"
          },
          {
            "title": "涉源企业用户",
            "desc": "业务办理 · 数据上报",
            "icon": "briefcase"
          },
          {
            "title": "现场执法人员",
            "desc": "移动巡检 · 应急处置",
            "icon": "smartphone"
          },
          {
            "title": "上级监管平台",
            "desc": "数据对接 · 指令接收",
            "icon": "link",
            "style": "purple"
          }
        ],
        "layers": [
          {
            "label": "业务应用层 · 场景赋能",
            "en": "APPLICATION LAYER",
            "style": "dark",
            "columns": 4,
            "items": [
              {
                "title": "放射源实时监控",
                "desc": "GPS/北斗定位 · 辐射剂量 · 电子围栏",
                "icon": "map_pin",
                "style": "accent"
              },
              {
                "title": "智能预警处置",
                "desc": "规则引擎 · 三级预警 · 闭环处置",
                "icon": "alert_triangle",
                "style": "danger"
              },
              {
                "title": "多维统计分析",
                "desc": "趋势分析 · 同比环比 · 大屏展示",
                "icon": "chart",
                "style": "accent"
              },
              {
                "title": "综合查询追溯",
                "desc": "全文检索 · 生命周期追溯 · 档案查询",
                "icon": "search"
              }
            ]
          },
          {
            "label": "平台服务层 · 能力中台",
            "en": "PLATFORM LAYER",
            "columns": 4,
            "items": [
              {
                "title": "统一接入网关",
                "desc": "多协议适配 · 负载均衡 · 限流熔断",
                "icon": "radio",
                "style": "success"
              },
              {
                "title": "业务流程引擎",
                "desc": "可视化流程 · 条件分支 · SLA监控",
                "icon": "activity"
              },
              {
                "title": "消息推送中心",
                "desc": "短信·APP·邮件·微信 多通道触达",
                "icon": "send"
              },
              {
                "title": "数据交换平台",
                "desc": "RESTful API · 批量同步 · 实时推送",
                "icon": "link",
                "style": "purple"
              },
              {
                "title": "统一身份认证",
                "desc": "SSO单点登录 · RBAC权限 · 操作审计",
                "icon": "shield"
              },
              {
                "title": "低代码配置中心",
                "desc": "表单设计 · 报表配置 · 规则编排",
                "icon": "code"
              }
            ]
          },
          {
            "label": "数据资源层 · 数据底座",
            "en": "DATA LAYER",
            "style": "dark",
            "items": [
              {
                "title": "放射源基础库",
                "desc": "源档案 · 许可证 · 台账信息",
                "icon": "database",
                "style": "accent"
              },
              {
                "title": "实时定位库",
                "desc": "轨迹数据 · 电子围栏 · 报警记录",
                "icon": "zap"
              },
              {
                "title": "监管业务库",
                "desc": "审批流程 · 巡检记录 · 执法文书",
                "icon": "folder"
              },
              {
                "title": "数据治理中心",
                "desc": "质量稽核 · 标准管理 · 数据血缘",
                "icon": "settings",
                "style": "success"
              },
              {
                "title": "数据备份恢复",
                "desc": "全量+增量 · 异地灾备 · RPO<5min",
                "icon": "refresh_cw",
                "style": "warning"
              }
            ]
          },
          {
            "label": "基础设施层 · 运行底座",
            "en": "INFRASTRUCTURE LAYER",
            "columns": 3,
            "items": [
              {
                "title": "政务云平台",
                "desc": "信创适配 · 弹性扩容 · 高可用",
                "icon": "server",
                "style": "success"
              },
              {
                "title": "安全防护体系",
                "desc": "WAF·防火墙·态势感知·零信任",
                "icon": "shield_off",
                "style": "warning"
              },
              {
                "title": "北斗定位终端",
                "desc": "4G/5G通信 · 防拆报警 · 低功耗",
                "icon": "radio"
              }
            ]
          }
        ],
        "integrations": [
          {
            "title": "国家核安全局平台",
            "desc": "数据上报 · 指令接收 · 季度报告"
          },
          {
            "title": "省级政务数据平台",
            "desc": "数据共享 · 接口调用 · 单点登录"
          },
          {
            "title": "公安应急联动系统",
            "desc": "110/119/120 应急联动 · 一键调度"
          },
          {
            "title": "第三方检测机构",
            "desc": "检测报告上传 · 资质核验"
          }
        ],
        "requirements": [
          {
            "title": "等保三级合规",
            "desc": "GB/T 22239-2019"
          },
          {
            "title": "数据加密传输",
            "desc": "国密SM2/SM4"
          },
          {
            "title": "可用性 ≥ 99.9%",
            "desc": "双活+灾备"
          },
          {
            "title": "接口响应 ≤ 500ms",
            "desc": "P95全链路"
          },
          {
            "title": "全量操作审计",
            "desc": "不可篡改"
          },
          {
            "title": "定位精度 ≤ 10m",
            "desc": "北斗差分"
          }
        ]
      },
      "visual": {
        "density": "spacious",
        "emphasis": "key_nodes"
      }
    }
  ]
}